{"id":"COMP-LIGHT-ADV-001","title":"Advanced Cannabis Photobiology and Light Distribution","domain":"advanced-lighting","description":"Evaluate cannabis lighting by spectrum, PPFD, DLI, photoperiod, canopy distribution, UV exposure and cultivar-specific response rather than fixture labels alone.","status":"draft","version":"1.0.0"}