{"id":"COMP-OUTDOOR-MGMT-001","title":"Outdoor and Protected-Culture Crop Management","domain":"outdoor-greenhouse","description":"Adapt irrigation, crop timing, airflow, weather protection and protected-culture management to changing outdoor and greenhouse conditions.","status":"draft","version":"1.0.0"}
