{
  "id": "COMP-PRO-SOP-001",
  "title": "Controlled SOP Development and Execution",
  "domain": "professional-sop",
  "description": "Create and maintain controlled cultivation procedures with clear scope, responsibilities, steps, records, training requirements, version control and approved change history.",
  "status": "published",
  "version": "1.0.0"
}
